Company Name,Job Name,Job Location,Job Description,Salary,Rating,Company Size,Company Type,Company Sector,Year Founded,Company Industry,Company Revenue
KOHLS,Staff Data Scientist,"Milpitas, CA","Interprets and applies data analytics to translate business insights into actionable items.
ACCOUNTABILITIES
Lead product decisions through data and insights; set goals, and identify the right levers to achieve those goals
Lead product team in determining intended approach and quantitative methods to develop solution
Oversee design experiments to answer targeted questions
Identify and drive continuous improvement of key business metrics in assigned business functional area
Drive adoption and usage of analytical products and models
Translate analytical outputs into business outcomes / value delivered - ability to break complex math into business outcomes
Maintain strong business partner relationships to gain cross organization alignment
Engage leaders across the organization in maximizing analytical capabilities to drive business optimization
Think in terms of iterative development, document, and communicate throughout products data science lifecycle
Build and validate models
QUALIFICATIONS
QUALIFICATIONS
Experience developing custom models based on in-depth understanding of underlying data, data structures, and business problems to ensure analytics deliverables meet stakeholders need
Experience developing state of the art algorithms using machine learning, statistical and optimization methods to power various aspects of highly complex business models
Experience working directly with cross-functional teams such as leadership, product management, design and engineering
Experience using modern analytics tools and languages such as Python, R, Spark, SQL (BigQuery), etc
Experience documenting, synthesizing, and communicating results at all levels of the organization
Strong problem solving skills with an emphasis on product development
Experience proposing rapid experiments to test the effect of new strategies or initiatives, and iterate quickly
REQUIRED
BS with 5+ years of experience (or MS with 2+ years) in Data Science, Computer Science, Machine Learning, Applied Mathematics, or equivalent quantitative field
Track record of guiding teams through unstructured technical problems to deliver business impact
Full stack experience across data science, analytics, and data engineering
PREFERRED
Masters degree and/or Ph.D.
Retail experience
Supply chain management
Marketing models
Logistics experience",$99K - $161K (Glassdoor est.),3.4,10000+ Employees,Company - Public,Retail & Wholesale,1962,"Department, Clothing & Shoe Stores",$10+ billion (USD)
"Tosh, Inc. dba Check City",Data Scientist,"Provo, UT","Tosh, Inc. is seeking an experienced data scientist who will support our product, sales, leadership and marketing teams with insights gained from analyzing internal and external data sources. The ideal candidate is adept at using large data sets to find opportunities for product and process optimization and using models to test the effectiveness of different courses of action. They must have strong experience using a variety of data mining/data analysis methods, using a variety of data tools, building and implementing models, using/creating algorithms and creating/running simulations. The candidate must have a proven ability to drive business results with their data-based insights. They must be comfortable working with a wide range of stakeholders and functional teams. The right candidate will have a passion for discovering solutions hidden in large data sets and working with stakeholders to improve business outcomes.
Responsibilities for Data Scientist
Work with stakeholders throughout the organization to identify opportunities for leveraging company data to drive business solutions.
Mine and analyze data from company databases to drive optimization and improvement of product development, marketing techniques and business strategies.
Assess the effectiveness and accuracy of new data sources and data gathering techniques.
Develop custom data models and algorithms to apply to data sets.
Use predictive modeling to increase and optimize customer experiences, revenue generation, ad targeting and other business outcomes.
Develop underwriting models and scorecards
Develop company A/B testing framework and test model quality.
Coordinate with different functional teams to implement models and monitor outcomes.
Develop processes and tools to monitor and analyze model performance and data accuracy.
Qualifications for Data Scientist
The ideal candidate will possess the following:
Strong problem-solving skills with an emphasis on product development.
Proficiency in statistical computer languages (R, Python, SQL, etc.).
Experience working with and creating data architectures.
Experience developing credit scorecards.
Knowledge of a variety of machine learning techniques (clustering, decision tree learning, artificial neural networks, etc.) and their real-world advantages/drawbacks.
Knowledge of advanced statistical techniques and concepts (regression, properties of distributions, statistical tests and proper usage, etc.) and experience with applications.
Excellent written and verbal communication skills for coordinating across teams.
A drive to learn and master new technologies and techniques.
A four-year degree in a related field: Mathematics, Statistics, Computer Science, Finance or Engineering
We’re looking for someone with at least four (4) years of professional experience manipulating data sets and building statistical models and is familiar with the following software/tools:
Coding knowledge and experience with several languages: C, C++, Java, JavaScript, etc.
Knowledge and experience in statistical and data mining techniques: GLM/Regression, Random Forest, Boosting, Trees, text mining, social network analysis, etc.
Experience querying databases and using statistical computer languages: R, Python, SQL, etc.
Experience creating and using advanced machine learning algorithms and statistics: regression, simulation, scenario analysis, modeling, clustering, decision trees, neural networks, etc.
Additional Qualifications a Plus
Experience with distributed data/computing tools: Map/Reduce, Hadoop, Hive, Spark, Gurobi, MySQL, etc.
Experience visualizing/presenting data for stakeholders using: Power BI, Tableau, Periscope, Business Objects, D3, ggplot, etc.
Experience using web services: Redshift, S3, Spark, DigitalOcean, etc.
Experience analyzing data from 3rd party providers: Google Analytics, Site Catalyst, Coremetrics, Adwords, Crimson Hexagon, Facebook Insights, etc.
Compensation & Benefits
In addition to a generous salary, we offer our employees the following benefits:
Company provided health insurance coverage for you and your immediate dependents
Excellent Wellness Program with Gym Reimbursement
401(k) with employer match
Generous PTO & paid holidays
Relaxed and people focused culture
Job Type: Full-time
Pay: $80,000.00 - $135,000.00 per year
Benefits:
401(k)
401(k) matching
Dental insurance
Flexible schedule
Flexible spending account
Health insurance
Life insurance
Paid time off
Schedule:
Monday to Friday
Supplemental Pay:
Bonus pay
Ability to commute/relocate:
Provo, UT 84604: Reliably commute or planning to relocate before starting work (Required)
Education:
Bachelor's (Preferred)
Experience:
Python: 1 year (Preferred)
SQL: 1 year (Preferred)
Work Location: One location",Employer Provided Salary:$80K - $135K,-1,-1,,,,,
Accenture,"Federal - Data Scientist (Huntsville, AL)","Atlanta, GA","Organization: Accenture Federal Services
We are:
Accenture Federal Services, helping our federal clients tackle their toughest challenges while unleashing their fullest potential…and then some. What makes our approach so unique? Operating from the nation’s capital, we bring together commercial innovation and leading-edge technologies to deliver an integrated and interactive experience that far exceeds expectations. How? Our passion meets purpose! Through our diverse culture and inclusive thinking, we embrace our employees' ideas taking them from concept to practical solutions. Not to mention, we sleep well at night knowing our work directly impacts and improves the way the world works. We keep our tech smarts sharp by providing abundant training and certification opportunities. Are you ready to learn and grow in a career, while making a difference?

You are:
A lover of patterns. Perhaps you grew up putting together 1,000-piece puzzles, finding that tiny detail that gave away the perfect placement. You're on your A-game with the latest tools and methods, from statistics to machine learning. While others were struggling through stats, you were living your best life. You lead the charge to work with business stakeholders to understand their goals and determine how data can be used. What sets you apart? Unlike the rest, you see and apply your work through a human lens. You live to take any data mess from drab to fab and transform it into a story that the average Joe and Jane can understand.

The work:
Work with clients to create questions and define technology opportunities
Drive the exploration of data sources and analytic techniques to create new modeling approaches
Work with large data sets to solve complex problems
Apply statistical methods to develop analytic models
Manage a technical team to solve clients’ solutions and expectations

Here's what experience you need:
Data programing languages to script, and analyze data using Python and/or R
Conducting complex queries in SQL or similar database language
Leading an analytics team responsible for driving data driven solutions utilizing statistical modeling and research to solve complex problems
Consulting or similar field requiring client collaboration, presentation, and delivery
Extracting data, aggregating, and structuring data along different dimensions
Bachelor's degree
US Citizenship and no Dual Citizenship
As required by the Colorado Equal Pay Transparency Act, Accenture Federal Services provides a reasonable range of minimum compensation for roles that may be hired in Colorado. Actual compensation is influenced by a wide array of factors including but not limited to skill set, level of experience, and specific office location. For the state of Colorado only, the range of starting pay for this role is $81,500 - $152,000 and information on benefits offered is here.
Important information
An active security clearance or the ability to obtain one may be required for this role.

Candidates who are currently employed by a client of Accenture or an affiliated Accenture business may not be eligible for consideration.

Applicants for employment in the U.S. must possess work authorization which does not require now or in the future sponsorship by the employer for a visa.

Accenture is a federal contractor, an EEO and Affirmative Action Employer of Females/Minorities/Veterans/Individuals with Disabilities.

Equal Employment Opportunity
All employment decisions shall be made without regard to age, race, creed, color, religion, sex, national origin, ancestry, disability status, veteran status, sexual orientation, gender identity or expression, genetic information, marital status, citizenship status or any other basis as protected by federal, state, or local law.

Job candidates will not be obligated to disclose sealed or expunged records of conviction or arrest as part of the hiring process.

Accenture is committed to providing veteran employment opportunities to our service men and women.

COVID-19 update:

The safety and well-being of our candidates, our people and their families continues to be a top priority. Until travel restrictions change, interviews will continue to be conducted virtually.

Subject to applicable law, please be aware that Accenture requires all employees to be fully vaccinated as a condition of employment. Accenture will consider requests for accommodation to this vaccination requirement during the recruiting process.

What We Believe

We have an unwavering commitment to diversity with the aim that every one of our people has a full sense of belonging within our organization. As a business imperative, every person at Accenture has the responsibility to create and sustain an inclusive environment.

Inclusion and diversity are fundamental to our culture and core values. Our rich diversity makes us more innovative and more creative, which helps us better serve our clients and our communities. Read more here

Equal Employment Opportunity Statement

Accenture is an Equal Opportunity Employer. We believe that no one should be discriminated against because of their differences, such as age, disability, ethnicity, gender, gender identity and expression, religion or sexual orientation.

All employment decisions shall be made without regard to age, race, creed, color, religion, sex, national origin, ancestry, disability status, veteran status, sexual orientation, gender identity or expression, genetic information, marital status, citizenship status or any other basis as protected by federal, state, or local law.

Accenture is committed to providing veteran employment opportunities to our service men and women.

For details, view a copy of the Accenture Equal Opportunity and Affirmative Action Policy Statement.

Requesting An Accommodation

Accenture is committed to providing equal employment opportunities for persons with disabilities or religious observances, including reasonable accommodation when needed. If you are hired by Accenture and require accommodation to perform the essential functions of your role, you will be asked to participate in our reasonable accommodation process. Accommodations made to facilitate the recruiting process are not a guarantee of future or continued accommodations once hired.

If you would like to be considered for employment opportunities with Accenture and have accommodation needs for a disability or religious observance, please call us toll free at 1 (877) 889-9009, send us an email or speak with your recruiter.

Other Employment Statements

Applicants for employment in the US must have work authorization that does not now or in the future require sponsorship of a visa for employment authorization in the United States.

Candidates who are currently employed by a client of Accenture or an affiliated Accenture business may not be eligible for consideration.

Job candidates will not be obligated to disclose sealed or expunged records of conviction or arrest as part of the hiring process.

The Company will not discharge or in any other manner discriminate against employees or applicants because they have inquired about, discussed, or disclosed their own pay or the pay of another employee or applicant. Additionally, employees who have access to the compensation information of other employees or applicants as a part of their essential job functions cannot disclose the pay of other employees or applicants to individuals who do not otherwise have access to compensation information, unless the disclosure is (a) in response to a formal complaint or charge, (b) in furtherance of an investigation, proceeding, hearing, or action, including an investigation conducted by the employer, or (c) consistent with the Company's legal duty to furnish information.",$67K - $177K (Glassdoor est.),4.1,10000+ Employees,Company - Public,Management & Consulting,1989,Business Consulting,$10+ billion (USD)
Carfax,Data Scientist,Remote,"Join our Winning Team as a Data Scientist
When was the last time you bragged about where you work? At CARFAX, we do it every day. Why? Because we’re proud to work for a company with a strong mission and trusted brand. We’re proud to work with people who care about what they do and work hard every day to deliver their best. And just announced, the return of the 4-day work week from Memorial Day through Labor Day! We’ve created the type of company culture where the term, “work- hard play- hard” isn’t just a catchy saying, it’s part of the #CARFAXdifference! Even today while working remotely, our culture is strong and our team is connected!

As a Data Scientist, you will be working with the Data Services and Data Technologies teams to create machine learning solutions for a new product. You will work collaboratively with data engineers and data mappers to design, build and scale our ambitious machine learning and natural language processing solutions.

As a Data Scientist, your responsibilities will include:
Leading the design, development and deployment of our deep learning, ML and NLP solutions
Maintaining and improving established, advanced machine learning processes on data mining
Providing actionable ad hoc analytics insights for internal stakeholders
Designing and building recurring reports for internal stakeholders to make data-driven decisions
Using advanced analytical methods to explore and extract additional data value for existing and emerging products
Documenting analysis results and presenting value to stakeholders
Creating reusable processes to assist data evaluation and analysis across teams within the Data Services department

To be considered for this role, you will need:
Master’s Degree in Statistics, Data Science or related field
4+ years’ experience in SQL/Spark, R, Python
4+ years of experience in building and applying machine learning, predictive modeling, or natural language processing solutions to business problems
Deep understanding and experience with advanced statistics and modern machine learning predictive techniques, including GLMs, decision trees, boosted ensembles, neural networks, deep learning, etc.
Experience with Named Entity Recognition (NER), Sentiment Analysis, Data Tokenization, Lexical Semantics, Relationship Extraction, etc.
A passion for continuous learning
Confidence to challenge the status quo",-1,4.4,1001 to 5000 Employees,Subsidiary or Business Segment,Information Technology,1984,Information Technology Support Services,Unknown / Non-Applicable
Apple,"AI/ML - Data Engineer (Speech Recognition), Siri and Language Technologies","Cambridge, MA","Summary
Posted: Apr 28, 2022
Weekly Hours: 40
Role Number:200372173
Would you like to play a part in the next revolution in human-computer interaction? Contribute to a product that is redefining mobile and desktop computing, and work with the people who built the intelligent assistant that helps millions of people get things done — just by asking? Create groundbreaking technology for large scale systems, spoken language, big data, and artificial intelligence. Join the Automatic Speech Recognition (ASR) team at Apple. The AIML ASR team is looking for exceptionally skilled and creative Scientists and Engineers eager to get involved in hands-on work improving the Siri experience.
Key Qualifications
2-5+ years of experience in data engineering.
Expertise with ETL theory, process and technology.
Experience engineering metrics and statistical information out of massive and complex datasets (e.g. Hive/Iceberg, Spark, Trino, Druid, Solr, Flink, Kafka).
Proficiency in at least one programming language (preferably Python) and with developing code within a team environment (e.g. git, testing, code reviews).
Experience building robust data and analytic pipelines with a keen eye for where to automate (e.g. Oozie, Airflow).
Solid understanding of both relational and NoSQL database technologies.
Experience with visualization, data mining, or statistical tools.
Description
The ideal candidate will have outstanding communication skills, proven data infrastructure design and implementation capabilities, strong eye for business, and a highly developed drive to deliver results. You will be a self-starter, comfortable with ambiguity and will enjoy working in a fast-paced dynamic environment. Responsibilities will include: - Building high-quality data pipelines and speech data tooling, implementing and operating with high reliability and availability. - Developing relationships with speech scientists and engineers, product managers and software engineers to understand data needs - Harden and launch new data models and data pipelines in production - Lead development of data tools to support analysis and data resources to support new product launches - Coordinate monitoring/analysis tools - Establish SLA’s for all data sets and processes running in production - Excellent writing and interpersonal skills - Thorough knowledge of macOS and iOS is helpful - Ability to stay focused and prioritize a heavy workload while achieving outstanding quality - You are upbeat, adaptable, and results-oriented with a positive attitude
Education & Experience
B.S., M.S., or PhD in Computer Science, Computer Engineering, or equivalent
Additional Requirements
Meeting any of the additional requirements is considered a plus:
Hands-on experience with ASR or NLP toolkits.
Hands-on experience with deep learning toolkits such as TensorFlow, PyTorch, etc.
Hands-on experience building and deploying production AI/ML systems.",-1,4.2,10000+ Employees,Company - Public,Information Technology,1976,Computer Hardware Development,$10+ billion (USD)
