Company Name,Job Name,Job Location,Job Description,Salary,Rating,Company Size,Company Type,Company Sector,Year Founded,Company Industry,Company Revenue
UPMC,"Lead Statistician, Health Plan - Remote","Pittsburgh, PA","Description
....
UPMC Health Plan is hiring a full time fully remote Lead Statistician for their Health Economics Department! In this position, you are responsible for the comprehensive evaluation and analysis of data and information for clinical, financial, and quality-related initiatives. You must be well versed in statistical method design, program evaluation, and advanced statistical modeling. You will need the ability to translate program goals and objectives into testable hypotheses and develop methods by which to test and evaluate them. In this role, you will need the ability to work with senior and c-level executives to conceptualize program design and methods and to articulate quantitative results to internal and external audiences.
Responsibilities:
The Lead Statistician will use expert knowledge of medical claims, clinical data, and other data sources to properly analyze and interpret, through the application of quantitative analytics, the impact of care delivery and finance on Health Plan or Health Services Division performance.
Routinely create and analyze financial and clinical results, including output from predictive models.
Work closely with senior executives to scope out Program evaluation projects, independently develop evaluation plans and provide consultation on methods and optimal design.
Demonstrate attention to detail and initiative in discovering errors in data or analyses, or determining the need for additional, follow-up analysis arising from the original assignment.
The successful Lead Statistician will: Independently prioritize and manage three to five advanced quantitative and/or statistical analytics projects simultaneously while receiving minimal supervision.
Produce customer-oriented reports that provide business context for the analysis and recommendations, requiring only minimal revision by the supervisor or analytics communications team.
Develop knowledge and expert understanding of products UPMC Health Plan insurance offerings, across all lines of business, and clinical initiatives to facilitate analysis.
Independently, or in teams, produce a combination of clinical program evaluation, quantitative financial analysis, and clinical utilization analysis to produce new insights into drivers of Health Plan or Health Services Division performance and clinical program efficacy.
Mentor more junior Statisticians. Healthcare is a fluid, dynamic, fast-paced environment. The successful employee is comfortable with ambiguity in priorities and is able to maintain professionalism and a team-player attitude in the face of analytical challenges of moderate-to-high complexity.
The Lead Statistician will consistently demonstrate a strong customer orientation, producing analyses on time and communicating results effectively.
Qualifications
Master's degree in mathematics, statistics, public health, decision sciences, economics, or a similar, quantitative field required
Minimum of six-to-eight years of work experience in a quantitative job function.
Demonstrated expertise in particularly-relevant analytical methods or health care business domain (payer/provider) may reduce time-in-position requirements.
Advanced Analytics Skill SetThe successful Lead Statistician can apply analytical and statistical software tools to produce complex, quantitative analyses of clinical programs and the health insurance industry.
Work typically includes the use of statistical analyses and predictive models.
Demonstrate consistent application of strong problem solving skills in the creation and interpretation of quantitative analyses, and to assist the supervisor in development of analysis plans.
Demonstrated ability to design rigorous program evaluation methods, including comparison group formulation and clinical, financial, and quality outcome analysis.
Interpret and communicate to management and colleagues, verbally and through written reports, the results of complex, quantitative analysis.
Prior experience with clinical modeling or data analysis is required.
Demonstrate prior application of analytics methods specifically to health insurance or health care delivery industry data at the advanced level.
Ability to leverage leading-edge analytics experience gained in other industries (e.g., population segmentation, risk analysis, optimization analytics, real-time analytics) to advance health care analytics will be strongly considered in lieu of health care experience.
General knowledge of business and economic principles strengthens the application.
Advanced Analytics Technology SkillsThe successful lead Statistician will have advanced-level experience using SAS, or R to conduct statistical analysis and modeling.
Demonstrated application of a similar programming language
#LI-ISD",$66K - $125K (Glassdoor est.),3.3,10000+ Employees,Nonprofit Organization,Healthcare,1982,Health Care Services & Hospitals,$10+ billion (USD)
Airlines Reporting Corporation (ARC),Senior Data Analyst,"Arlington, VA","About The Role:
** ARC requires all employees to be vaccinated against COVID-19.
We will consider medical and religious accommodations as required by law **
ARC is searching for a Senior Data Analyst to join our team. In this role, you will provide support around product-related analysis, research, and support on various projects related to the development and deployment of industry products. You will solicit input on requirements, dependencies, and resource availability to determine project approach. You will manage data mining projects to defined parameters. Additionally, you will present project status to management and mitigate risks to ensure project delivery. You will understand the entire scope and requirements of project(s), perform analysis around problem resolution and serve as the liaison between cross functional team members, Information Services development contractors or employees, product development, technical services, and product management.
What You'll Get to Do:
Perform product-related financial analysis, internal research, customer research, and develop business case scenarios and models. These business case scenarios and models will be used to quantify the financial opportunity, as well as evaluate the business, technical, and systems feasibility, of such opportunities
Explicitly define the business requirements for enhancements to existing products/services, as well as new products/services, of strategic and/or tactical importance to ARC and its carrier and strategic partner stakeholders.
Construct business application prototypes and work process tools using available technology such as MS Access, Excel, etc. to satisfy business process improvements or fill an automation need until a production solution can be justified and built.
Coordinate and track new product implementations, product enhancement implementations, and process improvements of strategic and/or tactical importance to ARC
Aggressively pursue, gain, and maintain a robust knowledge of products and services provided by ARC and various entities throughout the travel industry, as well as key stakeholder issues. Tenaciously apply this knowledge in support of innovative business solutions and enhancements.
Conduct on-going analysis of the business, operating practices, and process flows of ARC products in order to establish product processes and identify improvement opportunities that are aligned with the strategic objectives of ARC.
You'll Bring These Qualifications:
Bachelor’s degree in Data Science or related field.
5+ years of experience in data profiling and data analysis to investigate and validate data accuracy and manage data quality improvements
Experience discovering and defining functional requirements and transforming them into technical requirements and solution definition
Advanced knowledge of databases/SQL and BI report development
What We Can Offer You:
Joining ARC means joining a team that is motivated, diverse, creative, collaborative and solutions-oriented. We think big, embrace challenges, and explore new ideas to lead the way for the travel industry.
Our employees value the hands-on learning and professional development opportunities that allow them to expand their skills and grow their career in new, dynamic ways.
We offer a highly competitive, comprehensive benefits package so you can worry less and focus on what truly matters.
By joining ARC, you will partner with top minds in the industry as we use data and technology to innovate how the world travels.
EOE M/F/D/V Females and Minorities Encouraged to Apply
PM21
Job Type: Full-time",$66K - $125K (Glassdoor est.),4.4,201 to 500 Employees,Company - Private,Financial Services,1984,Financial Transaction Processing,$100 to $500 million (USD)
care.ai,Computer Vision / AI Data Scientist,Remote,"About care.ai
care.ai is the leading provider of a transformative AI planform for care facilities to make them smart. Our team bring bold, fresh thinking combined with technology, healthcare industry expertise to help make a genuine human impact on our clients, their patients, and their workforce.
Job Summary
The AI Engineer develops, evaluates and optimizes computer vision and deep learning models for various applications. In addition, the AI Engineer works with peers to drive solutions to meet product and technology requirements.
Experience Requirements
At least 2 years experience developing computer vision and deep learning applications.
Strong, demonstrable experience with Python along with relevant packages like numpy, scikit-learning, opencv, and matplotlib
Experience with machine learning frameworks
Experience with training deep learning models
Strong experience in developing classical computer vision algorithms.
Experience following Scrum methodology and version control systems.
Experience working on IoT platforms, linux embedded systems is a plus.
Experience with C, C++ is a plus.
Ability to work well in a team and collaborative environment.
Experience working in start-ups or other high demand, fast paced environments is a plus
Education Requirements
Bachelor’s degree/MS/PhD in Computer Science or other related field, or an equivalent combination of professional experience and education.
Preferred degree with specialization in deep learning, machine learning and computer vision.
Job Type: Full-time
Benefits:
401(k)
Dental insurance
Flexible schedule
Health insurance
Health savings account
Paid time off
Parental leave
Vision insurance
Schedule:
8 hour shift
Experience:
Python: 2 years (Preferred)
SQL: 2 years (Preferred)
machine learning frameworks: 2 years (Preferred)
C++: 2 years (Preferred)
Scrum: 2 years (Preferred)
Linux: 2 years (Preferred)
Work Location: Remote",$66K - $125K (Glassdoor est.),-1,-1,,,,,
vRad,Data Scientist,"Eden Prairie, MN","At Virtual Radiologic (vRad) you make a difference. Your skills, energy, and passion for results drive us to achieve strategic growth objectives and deliver quality patient care across the United States.
Virtual Radiologic is a national radiology practice and leader in the development of radiologist workflow technology. The dedication of vRad team members enables us to sustain our unique market-leading position and to provide the best quality and service to our customers and the patients we jointly serve. vRad team members exhibit energy and a passion for service excellence in our casually professional and collaborative work environment. We continually reward team members who embrace our fast-paced culture and who go the extra mile for our customers with internal recognition programs.
At vRad you make a difference.
WE ARE CURRENTLY LOOKING FOR A DATA SCIENTIST.
This position can be 100% remote or hybrid based out of our Eden Prairie, MN office.
About You:
You are a passionate, curious, and motivated professional that is trained and experienced in working with large amounts of complex data and translating it into useful information to drive improved business outcomes. You understand SQL and R programming languages at an intermediate or better level. You want to grow your skills at an organization where you feel like you can contribute and make an impact. You are a strong communicator and like working with other people as a team to accomplish your work, but also value some time working quietly or independently. You appreciate deadlines and try to meet them, and you’re always up for a challenge. You never settle for the bare minimum, and it shows because people know they can count on you for high quality and accurate work. You’re looking for your next challenge at a growing and exciting technology-focused and service-oriented organization where you can do your best work.
About Us:
vRad is the leading national teleradiology services and telemedicine company with over 500 U.S. board-certified and eligible physicians. Our team members are passionate about leading the industry and proving great service to our clients and the patients they serve. We leverage world class in-house developed tools to deliver radiology services to over 2,100 client hospitals, health systems, and radiology group facilities across the United States.
Summary:
The Data Scientist supports vRad’s Finance organization and other business functional areas by gathering, organizing, and analyzing data from multiple sources to extract trends and business insights. The incumbent will help leaders develop robust, sustainable, and well-organized processes to access and use data. The incumbent will also independently, and as part of various teams, work to develop predictive models, dashboards, and other business reports and present them to various levels within the organization. This position will require knowledge and use of database programming in either SQL or R to assist in gathering, analyzing, verifying, building and distributing data sets for use across the company. This role will also include a focus around automating existing and new reports and processes.
Essential Duties and Responsibilities:
Gather and integrate data from disparate sources including MS SQL server, Salesforce, Excel workbooks, and other sources and present for enterprise-level consumption
Ensure data integrity and accuracy with a comprehensive understanding of the source(s) of truth
Create graphical, tabular, and written reports to communicate information to stakeholders across the organization at various levels
Assist with creation and deployment of long-term data management structure and data reporting tools
Help to automate current reporting tools and assist different departments with reporting needs in a sustainable fashion that adhere to department standards
Create statistical models using regression, multi-variate, or other modeling techniques to drive predictions
Thoroughly analyze data, quickly identify relevant information, and transform it into a meaningful output
Perform ad hoc analysis as needed
Other duties as assigned
Qualifications/Education:
Four-year degree or equivalent work experience and training
A natural curiosity and an aptitude to organize information in a way that makes it useful
3-5 years of SQL and R programming language knowledge and experience required
Strong systems aptitude, including Microsoft Excel
Able to work as part of a fast-paced team and bring his/her experience and positive attitude to supporting a high growth business model
Strong ability to prioritize multiple activities and remain flexible to change
Strong written and verbal communication skills
Organized, objective and deadline-oriented
Strong analytical skills and good business acumen",$66K - $125K (Glassdoor est.),3.8,201 to 500 Employees,Company - Public,Healthcare,2001,Health Care Services & Hospitals,$25 to $50 million (USD)
Memorial Sloan Kettering Cancer Center,"Director, Data Science","New York, NY","Company Overview:
At Memorial Sloan Kettering (MSK), we’re not only changing the way we treat cancer, but also the way the world thinks about it. By working together and pushing forward with innovation and discovery, we’re driving excellence and improving outcomes. We’re treating cancer, one patient at a time. Join us and make a difference every day.

In compliance with applicable New York and New Jersey State regulatory authorities, COVID-19 vaccination (2 doses of either the Pfizer or Moderna vaccine or one dose of the Johnson & Johnson vaccine) is mandatory for all MSK employees, contingent workers, and volunteers. Exceptions are permitted for those who request and receive an approved medical or fully remote exemption. A COVID-19 booster, after 2 doses of either the Pfizer or Moderna vaccine or one dose of the Johnson & Johnson vaccine, isn’t required at this time but is highly effective and strongly encouraged for all staff.
Job Description:
Looking to make an impact? Want to use your skills to make the world's best cancer center even better? We're looking for an experienced leader to direct our Applied Data Science team.

We work with doctors, nurses, researchers, administration and executive leadership as they treat and cure cancer. This is a highly visible role requiring extensive interactions with senior leadership across the institution to identify areas of opportunity and ensuring business strategies

The Applied Data Science team specializes in using data modeling and predictive analytics to provide tailored, actionable information to improve patient care & hospital operations. From forecasting risk to extracting key concepts from the medical record, we bring cutting edge data science to real-world applications at MSK. Much of our work fits into the research and development lifecycle.
You will:
Contribute to vision of Data Science within the enterprise
Oversee the team’s portfolio of products
Recruit and manage and recruit a team of AI and ML data scientists
Mentor and provide technical and people leadership
Own our internal R&D lifecycle
Partner with leadership, clinicians, administrators, and technologists around the organization to understand major problems and opportunities
You have:
10+ years of industry experience in an evolving leadership role, significant AI/ML work, and experience managing a mature data science team
Work experience and a proven track record in brining ML productions into production
Experience with the R&D lifecycle and bringing ideas to prototype, then pilot
Benefits
Competitive compensation packages | Sick Time |Generous Vacation+ 12 holidays to recharge & refuel| Internal Career Mobility & Performance Consulting | Medical, Dental, Vision, FSA & Dependent Care|403b Retirement Savings Plan Match|Tuition Reimbursement |Parental Leave & Adoption Assistance |Commuter Spending Account |Fitness Discounts &Wellness Program | Resource Networks| Life Insurance & Disability | Remote Flexibility
We believe in communication, openness, and thinking beyond your 8-hour day @ MSK. It’s important to us that you have a sense of impact, community, and work/life balance to be and feel your best.
#LI-POST
Closing:
MSK is an equal opportunity and affirmative action employer committed to diversity and inclusion in all aspects of recruiting and employment. All qualified individuals are encouraged to apply and will receive consideration without regard to race, color, gender, gender identity or expression, sexual orientation, national origin, age, religion, creed, disability, veteran status or any other factor which cannot lawfully be used as a basis for an employment decision.

Federal law requires employers to provide reasonable accommodation to qualified individuals with disabilities. Please tell us if you require a reasonable accommodation to apply for a job or to perform your job. Examples of reasonable accommodation include making a change to the application process or work procedures, providing documents in an alternate format, using a sign language interpreter, or using specialized equipment.",$66K - $125K (Glassdoor est.),4.0,10000+ Employees,Nonprofit Organization,Healthcare,1884,Health Care Services & Hospitals,$2 to $5 billion (USD)
PRA Health Sciences,Statistical Programmer SDTM,Remote,"Overview
ICON plc is a world-leading healthcare intelligence and clinical research organisation. From molecule to medicine, we advance clinical research providing outsourced services to pharmaceutical, biotechnology, medical device and government and public health organisations.

With our patients at the centre of all that we do, we help to accelerate the development of drugs and devices that save lives and improve quality of life.

Our people are our greatest strength, are at the core of our culture, and the driving force behind our success. ICON people have a mission to succeed and a passion that ensures what we do, we do well.
Responsibilities
Deliverables:
Services rendered will adhere to applicable SOPs, WIs, policies,
local regulatory requirements, etc.
Provides expertise in planning, creation and oversight of clinical programming activities
and deliverables from study set-up to submission ready CDISC SDTM tabulation packages
(aCRF, define.xml, cSDRG, etc.).
Review and provide input into all trial set-up documentation.
Responsible for review or creation of aCRF, DTA metadata and trial design specifications.
Create or review mapping specifications for internal data and/or SDTM datasets.
Generate or review internal data and/or SDTM datasets using internal conversion
framework, utilities, and global checks Ensure quality review of all datasets (e.g., Pinnacle
21 compliance checking); ensure datasets are available for stakeholder use (medical
review, central monitoring, adaptive design, etc.) and compliant for interim and final
database locks.
Program, or oversee programming of, quality review checks and reports foruse by Data
Managers and other teammembers.
Responsible for creation of submission-ready SDTM packages for FDA/PMDA or other
regulatory authority submissions and keeping abreast in changing regulatory requirements.
Responsible for acquiring and maintaining working knowledge in the various and future
evolving data collection tools applied in the clinical trial space such as Medidata Rave,
Clinical Data Tools such as LSAF, Pinnacle 21, and in CDISC standards such as SDTM, CDASH,
Controlled terminology and define.xml.
Support the development ofstandards and drive their implementation within the
organization
Advanced:
Training/Mentoring of flex resources is expected to be done by higher
experience level when applicable
Leading a support team when applicable is expected to be done at the higher
experience level
Qualifications
Bachelor’s degree or higher and/or equivalent in computer science, data science/data
engineering, mathematics, or another relevant scientific field (or equivalent
theoretical/technical depth).
clinical programming experience and experience working on a clinicaltrial.
Expert knowledge of SAS programming, Define.xml, SDTM aCRF, cSDRGs.
Expert knowledge of data structures (e.g., CDISC SDTM, ADaM) and their implementation.
Experience working in highly diverse teams within clinical research; cross-functional, global,
multiregional.
Project management skills.
Highly organized with excellent written and verbal communication

Benefits of Working in ICON:

Our success depends on the knowledge, capabilities and quality of our people. That’s why we are committed to developing our employees in a continuous learning culture – one where we challenge you with engaging work and where every experience adds to your professional development.

At ICON, our focus is to provide you with a comprehensive and competitive total reward package that comprises, not only an excellent level of base pay, but also a wide range of variable pay and recognition programs. In addition, our best in class employee benefits, supportive policies and wellbeing initiatives are tailored to support you and your family at all stages of your career - both now, and into the future.

ICON, including subsidiaries, is an equal opportunity and inclusive employer and is committed to providing a workplace free of discrimination and harassment. All qualified applicants will receive equal consideration for employment without regard to race, color, religion, sex, sexual orientation, gender identity, national origin, disability or protected veteran status.

If, because of a medical condition or disability, you need a reasonable accommodation for any part of the application process, or in order to perform the essential functions of a position, please let us know.",$66K - $125K (Glassdoor est.),4.0,10000+ Employees,Company - Public,Pharmaceutical & Biotechnology,1976,Biotech & Pharmaceuticals,$2 to $5 billion (USD)
