Company Name,Job Name,Job Location,Job Description,Salary,Rating,Company Size,Company Type,Company Sector,Year Founded,Company Industry,Company Revenue
Thomson Reuters,Data Scientist,"McLean, VA","*Daily functions and duties of this role require on-site presence in Sterling, VA. Candidates considered for this position must be willing to comply with the on-site requirement.*
Are you passionate about the chance to bring your data quality improvement experience to a world class organization that is leading the way in both content and technology to serve and protect our citizens home and abroad? Do you have the skills necessary to manage, understand, and analyze in-house and customer data including text mining, developing predictive systems, risk scoring, creating efficient algorithms, data quality improvement and other related activities? Then Thomson Reuters Special Services (TRSS) is looking for you!
What You’ll Do: As a Data Scientist, you will be responsible for driving, identify, evaluate, design and implement statistical analyses of gathered open source, proprietary, and customer data to create analytic metrics and tools to support TRSS analysts, customers and existing product offerings. Successful candidates will have the opportunity to contribute directly to the features and capabilities deployed in our applications. They will work with customers to assist in gathering requirements and contributing to Statements of Work (SOWs) for new sales or POCs, and executing design post sale while getting deeply involved into the delivery of the proposed solutions. The role will interface with the customer and provide continuity of technical and data-exploration expertise to ensure we are delivering a workable solution that meets the customer requirements and technical capabilities. The position requires a proactive, mission-oriented person who strives to produce the best possible work for the customer.
As the Data Scientist, you will also contribute to a variety of areas including:
Working with interdisciplinary engineering and research teams on designing, building and deploying data analysis systems for large data sets.
Working closely with customers to apply data science to their mission specific content.
Creating algorithms to extract information from large data sets.
Establishment of scalable, efficient, automated processes for model development, model validation, model implementation, and large-scale data analysis.
Development of metrics and prototypes that can be used to drive business decisions.
Providing thought-leadership and dependable execution on diverse projects.
Identification of emergent trends and opportunities for future client growth and development.
Researching and identifying Artificial Intelligence (AI) methods – including Machine Learning (ML) and Natural Language Processing (NLP) methods.
Identification of new applications of AI in the context of Thomson Reuters and TRSS content sets.
Exploring existing data for insights, and recommends additional sources of data for improvement.
About You:
You’re a good fit for the role of Data Scientist if you have:
A minimum of DHS-granted public trust suitability required, active DOD Secret or Top-Secret clearance preferred.
A Master's degree or PhD in a quantitative field (e.g., statistics, computer science, mathematics, physical/biological sciences, or GIS).
10 years of experience with data cleaning, analysis, programming, and reporting of results to internal or external stakeholders (education can substitute for some years of experience)
Programming skills in one or more major programming languages (Python/R/Java).
Are creative, intellectually curious, and willing to experiment and work in dynamic organizations and situations, sometimes with little oversight or well-defined requirements.
The ability to take ownership for defined areas of accountability, most critically the integrity of the technical and data design in terms of meeting customer needs, design delivery and supportability.
A good understanding of distributed computing concepts.
Experience facilitating and gathering input from subject matter experts.
Excellent understanding of ML, NLP, and statistical methodologies.
The ability to test ideas and adapt methods quickly end to end from data extraction to implementation and validation.
Strong planning, time management, and organizational skills.
A team player / self-starter mentality with the ability to work using own initiative.
Ability to obtain and maintain a U.S. national security clearance.
Additional Desired Skills:
Big Data analytics experience (preferred, but not required).
Previous experience with data modeling for graphs (preferred, but not required).
Experience with search engines, classification algorithms, recommendation systems, and relevance evaluation methodologies (preferred, but not required).
What’s in it For You?
You will join our inclusive culture of world-class talent, where we are committed to your
personal and professional growth through:
COVID-19 Response: Currently many of our employees are working within a hybrid environment consisting of in-office and remote work, and following local COVID-19 bylaws and guidelines.
Culture: Globally recognized and award-winning reputation for equality, diversity and inclusion, flexibility, work-life balance, and more
Wellbeing: Comprehensive benefit plans; flexible and supportive benefits for work-life balance: company-wide Mental Health Days Off; Headspace app subscription; retirement, savings, tuition reimbursement, and employee incentive programs; resources for mental, physical, and financial wellbeing
Learning & Development: LinkedIn Learning access; internal Talent Marketplace with opportunities to work on projects cross-company; Ten Thousand Coffees Thomson Reuters café networking
Social Impact: Six employee-driven Employee Resource Groups; two paid volunteer days annually; Environmental, Social and Governance (ESG) initiatives for local and global impact
Purpose Driven Work: We have a superpower that we’ve never talked about with as much pride as we should – we are one of the only companies on the planet that helps its customers pursue justice, truth, and transparency. Together, with the professionals and institutions we serve, we help uphold the rule of law, turn the wheels of commerce, catch bad actors, report the facts, and provide trusted, unbiased information to people all over the world.
Do you want to be part of a team helping re-invent the way knowledge professionals work? How about a team that works every day to create a more transparent, just and inclusive future? At Thomson Reuters, we’ve been doing just that for almost 160 years. Our industry-leading products and services include highly specialized information-enabled software and tools for legal, tax, accounting and compliance professionals combined with the world’s most global news services – Reuters. We help these professionals do their jobs better, creating more time for them to focus on the things that matter most: advising, advocating, negotiating, governing and informing.
We are powered by the talents of 25,000 employees across more than 75 countries, where everyone has a chance to contribute and grow professionally in flexible work environments that celebrate diversity and inclusion. At a time when objectivity, accuracy, fairness and transparency are under attack, we consider it our duty to pursue them. Sound exciting? Join us and help shape the industries that move society forward.
Accessibility
As a global business, we rely on diversity of culture and thought to deliver on our goals. To ensure we can do that, we seek talented, qualified employees in all our operations around the world regardless of race, color, sex/gender, including pregnancy, gender identity and expression, national origin, religion, sexual orientation, disability, age, marital status, citizen status, veteran status, or any other protected classification under applicable law. Thomson Reuters is proud to be an Equal Employment Opportunity/Affirmative Action Employer providing a drug-free workplace.
We also make reasonable accommodations for qualified individuals with disabilities and for sincerely held religious beliefs in accordance with applicable law.
Protect yourself from fraudulent job postings click here to know more.
More information about Thomson Reuters can be found on thomsonreuters.com.",$66K - $125K (Glassdoor est.),3.8,10000+ Employees,Company - Public,Information Technology,2008,Enterprise Software & Network Solutions,$10+ billion (USD)
Infosys,Principal Data Scientist - Business Consulting,"Atlanta, GA","About Us
Infosys is a global leader in next-generation digital services and consulting. We enable clients in more than 50 countries to navigate their digital transformation. With over four decades of experience in managing the systems and workings of global enterprises, we expertly steer our clients through their digital journey. We do it by enabling the enterprise with an AI-powered core that helps prioritize the execution of change. We also empower the business with agile digital at scale to deliver unprecedented levels of performance and customer delight. Our always-on learning agenda drives their continuous improvement through building and transferring digital skills, expertise, and ideas from our innovation ecosystem.

EOE/Minority/Female/Veteran/Disabled/Sexual Orientation/Gender Identity/National Origin",$66K - $125K (Glassdoor est.),3.3,10000+ Employees,Company - Public,Information Technology,1981,Information Technology Support Services,$10+ billion (USD)
FirstKey Homes,Data Scientist,"Atlanta, GA","SUMMARY OF RESPONSIBILITIES
The Data Scientist will use Python programming to implement machine learning models designed to improve operational performance. Projects may relate to price (rent) optimization, customer segmentation, asset segmentation, and cost prediction. The Data Scientist will work closely with the VP, Revenue Management to define projects and with IT partners (ML Engineers, DevOps Engineers) to execute projects. S/he will be working in a fast paced, high-growth environment that requires adaptability, comfortable working without defined processes, and responding to requests with a sense of urgency.

ESSENTIAL DUTIES
Build machine learning models to assist with business problems related to optimization, segmentation, and prediction.
Partner with IT resources (Machine Learning Engineers, DevOps Engineers) to productionize models on FirstKey Homes' cloud infrastructure.
Communicate data requirements to Data Analysts who will support the creation of datasets required by machine learning models
Develop and present results with PowerPoint or other reporting tools to business leaders as needed. Ensure algorithms and concepts are presented into easily understood concepts. Provide insights for evidenced based recommendations.
Assist with coaching and mentoring junior Revenue Management team members to build their skillsets.
This brief summary is not an all-inclusive description of job duties. Other job duties and responsibilities may also be assigned by the incumbent's manager at any time based upon Company need.

To perform this job successfully, an individual must be able to perform each essential duty satisfactorily. The requirements listed below are representative of the knowledge, skill, and/or ability required. Reasonable accommodations may be made to enable individuals with disabilities to perform the essential functions.
WORKING CONDITIONS
Primarily working indoors, office environment.
May sit for several hours at a time.
Prolonged exposure to computer screens.
Repetitive use of hands to operate computers, printers, and copiers.

REQUIRED EDUCATION AND EXPERIENCE
Master's degree in applied Mathematics, Statistics, Computer Science or equivalent experience and/or education.
Minimum 2 years with data science and machine learning experience.
Professional experience with Microsoft Azure, Amazon Web Services (AWS) or similar cloud technologies.
Advanced knowledge of data science concepts (various modeling types, data manipulation methods).
Experience programming statistical models in Python.
Advanced knowledge of data ingestion methods and relational databases (SQL databases, CSVs, etc.).
Familiar with machine learning models such as regression, classification and segmentation..
PREFERRED EDUCATION AND EXPERIENCE
Experience working in fast pace, high-growth company.
PhD in STEM-related field.
REQUIRED KNOWLEDGE
Mathematics— Knowledge of arithmetic, algebra, geometry, calculus, statistics, and their applications.
Computers— Knowledge of computer software, including applications and programming.

REQUIRED SKILLS
Active Learning — Understanding the implications of new information for both current and future problem-solving and decision-making.
Critical Thinking — Using logic and reasoning to identify the strengths and weaknesses of alternative solutions, conclusions or approaches to problems.
Complex Problem Solving — Identifying complex problems and reviewing related information to develop and evaluate options and implement solutions.
Judgment and Decision Making — Considering the relative costs and benefits of potential actions to choose the most appropriate one.
Mathematics — Using mathematics to solve problems.
Programming — Writing computer programs for various purposes.
Science — Using scientific rules and methods to solve problems.
Systems Analysis — Determining how a system should work and how changes in conditions, operations, and the environment will affect outcomes.
Systems Evaluation — Identifying measures or indicators of system performance and the actions needed to improve or correct performance, relative to the goals of the system.
Monitoring — Monitoring/Assessing performance of yourself, other individuals, or organizations to make improvements or take corrective action.
Time Management — Managing one's own time and the time of others.
Speaking — Talking to others to convey information effectively.
Writing — Communicating effectively in writing as appropriate for the needs of the audience.

WORK STYLES & BEHAVIORS
Integrity— Job requires being honest and ethical.
Analytical Thinking— Job requires analyzing information and using logic to address work-related issues and problems.
Initiative— Job requires a willingness to take on responsibilities and challenges.
Cooperation— Job requires being pleasant with others on the job and displaying a good-natured, cooperative attitude.
Attention to Detail— Job requires being careful about detail and thorough in completing work tasks.
Adaptability/Flexibility— Job requires being open to change (positive or negative) and to considerable variety in the workplace.
FirstKey Homes is an equal opportunity employer and will not tolerate discrimination in employment on the basis of race, color, age, sex, sexual orientation, gender identity or expression, religion, disability, ethnicity, national origin, marital status, veteran status, genetic information or any other legally protected classification or status.
IND1",$66K - $125K (Glassdoor est.),4.0,501 to 1000 Employees,Company - Private,Real Estate,2015,Real Estate,Unknown / Non-Applicable
Bloomberg,Data Scientist,"New York, NY","What is Enterprise Data?

Bloomberg's Enterprise Data department develops data offerings that are considered best in class by the capital markets community. Across real time market data, reference data, historical pricing data, and unique analytics we offer:
The most comprehensive and highest quality content in the industry
Distribution platforms that are flexible, reliable, fast, and easy to onboard
Easy to use data that is ready for analysis

These critical datasets serve as the primary source of information across the front, middle, and back office at the most respected capital markets firms across the globe.

What is the Role?

Capital markets firms are purposefully embracing data science and machine learning techniques into their workflows. Motivated by increasingly sophisticated competition or cost savings, data science and machine learning have become a critical aspect of our customers"" business strategies. Bloomberg wants to be the leader in analysis ready data that allows clients to focus on the business of creating advanced analytics solutions rather than data ingestion and normalization.

You will play a meaningful role in helping customers and Bloomberg, together, achieve success. As a hands on liaison between Bloomberg product development teams and the data science teams at our customers, the Data Scientist will provide experienced technical design, data science thought leadership, and Bloomberg recommended standard methodologies as customers develop solutions on premises or in the public cloud.

The ideal candidate will be a customer focused data scientist with advanced technology skills that seeks opportunities to get their hands dirty while confidently working with clients to design and build solutions that will best demonstrate Bloomberg content and technology in conjunction with modern data science tools and workflows.

We'll Trust you to:
Lead deep technical discussions with customers, vendor partners, and Bloomberg colleagues from Product, Sales, Quant Research & Development, Engineering, and Client Services
Effectively communicate advanced statistical and technical concepts with various audiences
Serve as subject matter experts in demonstrating advanced data science workflows and technologies for capital markets use cases
Engage with customers as part of their solution creation team
Confidently make recommendations (based on standard methodologies) to customers and partners
Develop collateral including tutorials, sample code, reference implementations, and presentations that will be used by data science practitioners as well as executive decision makers
Provide feedback to Product, Quant, and Engineering teams to help shape product strategy and execution roadmap
Balance hands on work with a desire to keep up with trends

What do I need to apply?
Understanding of a wide range of statistical models (e.g. regression, decision trees, artificial neural networks) and their underlying assumptions
Good programming skills in at least one of the commonly used languages for data analysis (e.g., python, R, Matlab. Knowledge of any other programming language is a plus.)
Experience with applying data science/quantitative modeling to real world, financial use cases commonly deployed at capital market firms
Knowledge of leading open source data analysis tools and machine learning libraries
Experience in crafting technical documentation and presentations (white-board, small team, broad audience) and the ability to present to a technical and non-technical audience.
Entrepreneurial mindset and comfortable to work in a non-hierarchical, large global organization where interaction with senior management is required
Passion for constant learning
Ability to travel

It""s a Plus if you have:
Experience applying advanced machine learning to large scale, financial modelling problems
Master's degree or Ph.D. in a quantitative discipline
Knowledge of AWS, GCP, and/or Azure data science and machine learning services
Experience with tools and frameworks enabling large scale data analysis (e.g., Spark)
End-to-end knowledge of the data science problem, including large scale data and data pipeline management
Understanding of capital markets, banking, asset management, and/or the trade lifecycle

We are an equal opportunity employer and value diversity at our company. We do not discriminate on the basis of race, religion, colour, national origin, gender, sexual orientation, age, marital status or disability status.",$66K - $125K (Glassdoor est.),4.0,10000+ Employees,Company - Private,Information Technology,1981,Computer Hardware Development,Unknown / Non-Applicable
BAE Systems,Artificial Intelligence (AI) Subject Matter Expert Level 2,"Annapolis Junction, MD","Produces high quality, professional, and innovative solutions to complex and technologically[1]advanced AI problems. Recognized as an AI expert by peers and customers. Works on the forefront of new AI technologies.

Required Education, Experience, & Skills
The Level 2 Artificial Intelligence (AI) Subject Matter Expert (Sme) shall possess the following capabilities:
Develops and executes cutting-edge research programs to create and then experimentally prove innovative and effective solutions to complex AI technical problems
Directs a team of engineers and/or scientists to implement solutions to complex AI technical problems.
Qualifications: Fifteen (15) years' experience and a Bachelor's degree in Engineering, Computer Science, or Science, Technology, Engineering, or Mathematics (STEM) or thirteen (13) years' and a Master's degree or ten (10) years' and a PhD.
About BAE Systems Intelligence & Security
BAE Systems, Inc. is the U.S. subsidiary of BAE Systems plc, an international defense, aerospace and security company which delivers a full range of products and services for air, land and naval forces, as well as advanced electronics, security, information technology solutions and customer support services. Improving the future and protecting lives is an ambitious mission, but it’s what we do at BAE Systems. Working here means using your passion and ingenuity where it counts – defending national security with breakthrough technology, superior products, and intelligence solutions. As you develop the latest technology and defend national security, you will continually hone your skills on a team—making a big impact on a global scale. At BAE Systems, you’ll find a rewarding career that truly makes a difference.

Intelligence & Security (I&S), based in McLean, Virginia, designs and delivers advanced defense, intelligence, and security solutions that support the important missions of our customers. Our pride and dedication shows in everything we do—from intelligence analysis, cyber operations and IT expertise to systems development, systems integration, and operations and maintenance services. Knowing that our work enables the U.S. military and government to recognize, manage and defeat threats inspires us to push ourselves and our technologies to new levels.

Our Commitment to Diversity, Equity, and Inclusion:
At BAE Systems, we work hard every day to nurture an inclusive culture where employees are valued and feel like they belong. We are conscious of the need for all employees to see themselves reflected at every level of the company and know that in order to unlock the full potential of our workforce, everyone must feel confident being their best, most sincere self and be equipped to thrive. We provide impactful professional development experiences to our employees and invest in social impact partnerships to uplift communities and drive purposeful change. Here you will find significant opportunities to do meaningful work in an environment intentionally designed to be one where you will learn, grow and belong.",$66K - $125K (Glassdoor est.),3.7,10000+ Employees,Subsidiary or Business Segment,Aerospace & Defense,1999,Aerospace & Defense,$10 to $25 million (USD)
